{
  "name": "layered-animation-button",
  "category": "button",
  "framework": "react",
  "tags": ["button", "layered", "animation", "hover", "modern", "3d"],
  "author": "alirezazim03",
  "license": "MIT",
  "version": "1.0.0",
  "preview": "A modern layered button with 3D shadow effects and smooth hover animations",
  "props": [
    {
      "name": "children",
      "type": "string | ReactNode",
      "description": "The content to display inside the button",
      "default": "LAYERS"
    },
    {
      "name": "onClick",
      "type": "function",
      "description": "Callback function when button is clicked",
      "default": "() => {}"
    },
    {
      "name": "className",
      "type": "string",
      "description": "Additional CSS classes to apply to the button",
      "default": ""
    },
    {
      "name": "disabled",
      "type": "boolean",
      "description": "Whether the button is disabled",
      "default": false
    },
    {
      "name": "variant",
      "type": "string",
      "description": "Button color variant: 'primary', 'secondary', or 'accent'",
      "default": "primary"
    }
  ]
}
